{
  "artworks" : [
    {
      "artist" : {
        "birth_year" : 1452,
        "death_year" : 1519,
        "display_name" : "Leonardo da Vinci",
        "id" : "leonardo-da-vinci",
        "nationality" : "Italian"
      },
      "category_id" : "renaissance_it",
      "date" : {
        "circa" : true,
        "display" : "c. 1499–1510",
        "end" : 1510,
        "start" : 1499
      },
      "game_price_id" : "leonardo-salvator-mundi-p1",
      "id" : "leonardo-salvator-mundi",
      "images" : {
        "primary" : {
          "alt_text" : "Salvator Mundi by Leonardo da Vinci",
          "attribution" : "Fixture image (synthetic)",
          "depicts_scope" : "this_object",
          "dominant_hex" : "#3A3027",
          "focus" : {
            "x" : 500,
            "y" : 400
          },
          "lg" : {
            "file" : "leonardo-salvator-mundi_lg.jpg",
            "h" : 1600,
            "w" : 1280
          },
          "licence" : "CC0",
          "palette" : [
            "#3A3027",
            "#62584F",
            "#8A8077",
            "#1C1209",
            "#000000"
          ],
          "sm" : {
            "file" : "leonardo-salvator-mundi_sm.jpg",
            "h" : 750,
            "w" : 600
          }
        }
      },
      "kind" : "pd_masterpiece",
      "medium" : {
        "display" : "Oil on walnut",
        "medium_class" : "painting"
      },
      "prices" : [
        {
          "adjust_ref_year" : 2025,
          "amount_minor" : 45031250000,
          "approximate" : false,
          "confidence" : "high",
          "currency" : "USD",
          "date" : "2017-11-15",
          "game_eligible" : true,
          "id" : "leonardo-salvator-mundi-p1",
          "log10_usd_adjusted_milli" : 8771,
          "log10_usd_nominal_milli" : 8654,
          "lower_bound" : false,
          "premium_included" : true,
          "price_scope" : "this_object",
          "source_urls" : [
            "https://example.org/fixture/leonardo-salvator-mundi"
          ],
          "type" : "auction_premium",
          "usd_adjusted" : 589909375,
          "usd_nominal" : 450312500,
          "venue" : "Christie's New York"
        }
      ],
      "secondary_category_ids" : [

      ],
      "taste" : {
        "abstraction" : 10,
        "brightness" : 25,
        "complexity" : 35,
        "era_bucket" : "pre1500",
        "mood" : "serene",
        "saturation" : 25,
        "subject" : "religious_myth",
        "warmth" : 55
      },
      "title" : "Salvator Mundi"
    },
    {
      "artist" : {
        "birth_year" : 1445,
        "death_year" : 1510,
        "display_name" : "Sandro Botticelli",
        "id" : "sandro-botticelli",
        "nationality" : "Italian"
      },
      "category_id" : "renaissance_it",
      "date" : {
        "circa" : true,
        "display" : "c. 1480",
        "end" : 1480,
        "start" : 1480
      },
      "game_price_id" : "botticelli-young-man-roundel-p1",
      "id" : "botticelli-young-man-roundel",
      "images" : {
        "primary" : {
          "alt_text" : "Young Man Holding a Roundel by Sandro Botticelli",
          "attribution" : "Fixture image (synthetic)",
          "depicts_scope" : "this_object",
          "dominant_hex" : "#5B6E7A",
          "focus" : {
            "x" : 500,
            "y" : 400
          },
          "lg" : {
            "file" : "botticelli-young-man-roundel_lg.jpg",
            "h" : 1600,
            "w" : 1280
          },
          "licence" : "CC0",
          "palette" : [
            "#5B6E7A",
            "#8396A2",
            "#ABBECA",
            "#3D505C",
            "#1F323E"
          ],
          "sm" : {
            "file" : "botticelli-young-man-roundel_sm.jpg",
            "h" : 750,
            "w" : 600
          }
        }
      },
      "kind" : "pd_masterpiece",
      "medium" : {
        "display" : "Tempera on panel",
        "medium_class" : "painting"
      },
      "prices" : [
        {
          "adjust_ref_year" : 2025,
          "amount_minor" : 9218450000,
          "approximate" : false,
          "confidence" : "high",
          "currency" : "USD",
          "date" : "2021-01-28",
          "game_eligible" : true,
          "id" : "botticelli-young-man-roundel-p1",
          "log10_usd_adjusted_milli" : 8040,
          "log10_usd_nominal_milli" : 7965,
          "lower_bound" : false,
          "premium_included" : true,
          "price_scope" : "this_object",
          "source_urls" : [
            "https://example.org/fixture/botticelli-young-man-roundel"
          ],
          "type" : "auction_premium",
          "usd_adjusted" : 109699555,
          "usd_nominal" : 92184500,
          "venue" : "Sotheby's New York"
        }
      ],
      "secondary_category_ids" : [

      ],
      "taste" : {
        "abstraction" : 8,
        "brightness" : 55,
        "complexity" : 40,
        "era_bucket" : "pre1500",
        "mood" : "serene",
        "saturation" : 45,
        "subject" : "portrait",
        "warmth" : 60
      },
      "title" : "Young Man Holding a Roundel"
    },
    {
      "artist" : {
        "birth_year" : 1471,
        "death_year" : 1528,
        "display_name" : "Albrecht Dürer",
        "id" : "albrecht-dürer",
        "nationality" : "German"
      },
      "category_id" : "renaissance_north",
      "date" : {
        "circa" : false,
        "display" : "1514",
        "end" : 1514,
        "start" : 1514
      },
      "game_price_id" : "durer-melencolia-i-p1",
      "id" : "durer-melencolia-i",
      "images" : {
        "primary" : {
          "alt_text" : "Melencolia I by Albrecht Dürer",
          "attribution" : "Fixture image (synthetic)",
          "depicts_scope" : "same_edition_other_impression",
          "dominant_hex" : "#8C8577",
          "focus" : {
            "x" : 500,
            "y" : 400
          },
          "lg" : {
            "file" : "durer-melencolia-i_lg.jpg",
            "h" : 1600,
            "w" : 1280
          },
          "licence" : "CC0",
          "palette" : [
            "#8C8577",
            "#B4AD9F",
            "#DCD5C7",
            "#6E6759",
            "#50493B"
          ],
          "sm" : {
            "file" : "durer-melencolia-i_sm.jpg",
            "h" : 750,
            "w" : 600
          }
        }
      },
      "kind" : "pd_masterpiece",
      "medium" : {
        "display" : "Engraving",
        "medium_class" : "print"
      },
      "prices" : [
        {
          "adjust_ref_year" : 2025,
          "amount_minor" : 48000000,
          "approximate" : false,
          "confidence" : "high",
          "currency" : "USD",
          "date" : "2019-06-12",
          "game_eligible" : true,
          "id" : "durer-melencolia-i-p1",
          "log10_usd_adjusted_milli" : 5782,
          "log10_usd_nominal_milli" : 5681,
          "lower_bound" : false,
          "premium_included" : true,
          "price_scope" : "same_edition_other_impression",
          "source_urls" : [
            "https://example.org/fixture/durer-melencolia-i"
          ],
          "type" : "auction_premium",
          "usd_adjusted" : 604800,
          "usd_nominal" : 480000,
          "venue" : "Christie's New York"
        }
      ],
      "secondary_category_ids" : [
        "print"
      ],
      "taste" : {
        "abstraction" : 20,
        "brightness" : 50,
        "complexity" : 85,
        "era_bucket" : "1500_1600",
        "mood" : "melancholic",
        "saturation" : 5,
        "subject" : "figure",
        "warmth" : 50
      },
      "title" : "Melencolia I"
    },
    {
      "artist" : {
        "birth_year" : 1472,
        "death_year" : 1553,
        "display_name" : "Lucas Cranach the Elder",
        "id" : "lucas-cranach-the-elder",
        "nationality" : "German"
      },
      "category_id" : "renaissance_north",
      "date" : {
        "circa" : true,
        "display" : "c. 1530–1534",
        "end" : 1534,
        "start" : 1530
      },
      "game_price_id" : "cranach-nymph-of-the-spring-p1",
      "id" : "cranach-nymph-of-the-spring",
      "images" : {
        "primary" : {
          "alt_text" : "The Nymph of the Spring by Lucas Cranach the Elder",
          "attribution" : "Fixture image (synthetic)",
          "depicts_scope" : "this_object",
          "dominant_hex" : "#2E3B2A",
          "focus" : {
            "x" : 500,
            "y" : 400
          },
          "lg" : {
            "file" : "cranach-nymph-of-the-spring_lg.jpg",
            "h" : 1600,
            "w" : 1280
          },
          "licence" : "CC0",
          "palette" : [
            "#2E3B2A",
            "#566352",
            "#7E8B7A",
            "#101D0C",
            "#000000"
          ],
          "sm" : {
            "file" : "cranach-nymph-of-the-spring_sm.jpg",
            "h" : 750,
            "w" : 600
          }
        }
      },
      "kind" : "pd_masterpiece",
      "medium" : {
        "display" : "Oil on panel",
        "medium_class" : "painting"
      },
      "prices" : [
        {
          "adjust_ref_year" : 2025,
          "amount_minor" : 945000000,
          "approximate" : true,
          "confidence" : "high",
          "currency" : "GBP",
          "date" : "2015-07-08",
          "game_eligible" : true,
          "id" : "cranach-nymph-of-the-spring-p1",
          "log10_usd_adjusted_milli" : 7299,
          "log10_usd_nominal_milli" : 7166,
          "lower_bound" : false,
          "premium_included" : true,
          "price_scope" : "this_object",
          "source_urls" : [
            "https://example.org/fixture/cranach-nymph-of-the-spring"
          ],
          "type" : "auction_premium",
          "usd_adjusted" : 19924000,
          "usd_nominal" : 14650000,
          "venue" : "Sotheby's London"
        }
      ],
      "secondary_category_ids" : [

      ],
      "taste" : {
        "abstraction" : 10,
        "brightness" : 45,